{
  "version": 1,
  "updated_at": "2026-05-17",
  "description": "Curated registry of official academic, institution, lab, and company identity sources. This file is resolver input, not a license grant.",
  "curation_policy": {
    "default_status": "trusted_official_domain",
    "direct_placement_requires": [
      "official_domain_match",
      "https_url",
      "provenance_recorded",
      "safe_raster_or_sanitized_svg"
    ],
    "blocked_sources": [
      "search_result_image_direct",
      "wikipedia_or_wikimedia",
      "social_media",
      "news_or_blog_mirror",
      "user_generated_upload_without_request"
    ],
    "binary_asset_policy": "Do not commit downloaded logo binaries here unless they have an explicit redistribution clearance. Runtime downloads belong in run layers/cache with source provenance."
  },
  "rules": [
    {
      "id": "venue-neurips",
      "entity_name": "NeurIPS",
      "role": "venue",
      "aliases": ["NeurIPS", "NIPS", "Conference on Neural Information Processing Systems"],
      "official_domains": ["neurips.cc", "nips.cc"],
      "homepages": ["https://neurips.cc/"],
      "preferred_page_urls": ["https://neurips.cc/"],
      "preferred_asset_urls": ["https://neurips.cc/static/core/img/NeurIPS-logo.svg"],
      "confidence": 0.88,
      "curation_status": "trusted_official_domain",
      "tags": ["ml", "conference"]
    },
    {
      "id": "venue-icml",
      "entity_name": "ICML",
      "role": "venue",
      "aliases": ["ICML", "International Conference on Machine Learning"],
      "official_domains": ["icml.cc"],
      "homepages": ["https://icml.cc/"],
      "preferred_page_urls": ["https://icml.cc/"],
      "preferred_asset_urls": ["https://icml.cc/static/core/img/ICML-logo.svg"],
      "confidence": 0.88,
      "curation_status": "trusted_official_domain",
      "tags": ["ml", "conference"]
    },
    {
      "id": "venue-iclr",
      "entity_name": "ICLR",
      "role": "venue",
      "aliases": ["ICLR", "International Conference on Learning Representations"],
      "official_domains": ["iclr.cc"],
      "homepages": ["https://iclr.cc/"],
      "preferred_page_urls": ["https://iclr.cc/"],
      "preferred_asset_urls": ["https://iclr.cc/static/core/img/ICLR-logo.svg"],
      "confidence": 0.88,
      "curation_status": "trusted_official_domain",
      "tags": ["ml", "conference"]
    },
    {
      "id": "venue-cvpr",
      "entity_name": "CVPR",
      "role": "venue",
      "aliases": [
        "CVPR",
        "IEEE/CVF Conference on Computer Vision and Pattern Recognition",
        "Conference on Computer Vision and Pattern Recognition"
      ],
      "official_domains": ["thecvf.com", "cvpr.thecvf.com", "cvf.org", "ieee.org"],
      "homepages": ["https://cvpr.thecvf.com/"],
      "preferred_page_urls": ["https://cvpr.thecvf.com/"],
      "confidence": 0.86,
      "curation_status": "trusted_official_domain",
      "tags": ["vision", "conference"]
    },
    {
      "id": "venue-iccv",
      "entity_name": "ICCV",
      "role": "venue",
      "aliases": ["ICCV", "International Conference on Computer Vision", "IEEE/CVF International Conference on Computer Vision"],
      "official_domains": ["thecvf.com", "iccv.thecvf.com", "cvf.org", "ieee.org"],
      "homepages": ["https://iccv.thecvf.com/"],
      "preferred_page_urls": ["https://iccv.thecvf.com/"],
      "confidence": 0.84,
      "curation_status": "trusted_official_domain",
      "tags": ["vision", "conference"]
    },
    {
      "id": "venue-eccv",
      "entity_name": "ECCV",
      "role": "venue",
      "aliases": ["ECCV", "European Conference on Computer Vision", "European Computer Vision Association"],
      "official_domains": ["ecva.net", "eccv.ecva.net"],
      "homepages": ["https://eccv.ecva.net/"],
      "preferred_page_urls": ["https://eccv.ecva.net/"],
      "preferred_asset_urls": ["https://eccv.ecva.net/media/Images/ECVA_logo.jpg"],
      "confidence": 0.84,
      "curation_status": "trusted_official_domain",
      "tags": ["vision", "conference"]
    },
    {
      "id": "venue-acl",
      "entity_name": "ACL",
      "role": "venue",
      "aliases": ["ACL", "Association for Computational Linguistics", "Annual Meeting of the Association for Computational Linguistics"],
      "official_domains": ["aclweb.org"],
      "homepages": ["https://www.aclweb.org/"],
      "preferred_page_urls": ["https://www.aclweb.org/"],
      "confidence": 0.84,
      "curation_status": "trusted_official_domain",
      "tags": ["nlp", "conference", "society"]
    },
    {
      "id": "venue-emnlp",
      "entity_name": "EMNLP",
      "role": "venue",
      "aliases": ["EMNLP", "Empirical Methods in Natural Language Processing"],
      "official_domains": ["aclweb.org", "sigdat.org"],
      "homepages": ["https://www.aclweb.org/portal/content/special-interest-group-linguistic-data-and-corpus-based-approaches-nlp-sigdat"],
      "preferred_page_urls": ["https://sigdat.org/"],
      "confidence": 0.8,
      "curation_status": "trusted_official_domain",
      "tags": ["nlp", "conference"]
    },
    {
      "id": "venue-aaai",
      "entity_name": "AAAI",
      "role": "venue",
      "aliases": ["AAAI", "Association for the Advancement of Artificial Intelligence", "AAAI Conference on Artificial Intelligence"],
      "official_domains": ["aaai.org"],
      "homepages": ["https://aaai.org/"],
      "preferred_page_urls": ["https://aaai.org/"],
      "confidence": 0.82,
      "curation_status": "trusted_official_domain",
      "tags": ["ai", "conference", "society"]
    },
    {
      "id": "venue-kdd",
      "entity_name": "KDD",
      "role": "venue",
      "aliases": ["KDD", "ACM SIGKDD", "Knowledge Discovery and Data Mining"],
      "official_domains": ["kdd.org", "sigkdd.org", "acm.org"],
      "homepages": ["https://www.kdd.org/"],
      "preferred_page_urls": ["https://www.kdd.org/"],
      "confidence": 0.82,
      "curation_status": "trusted_official_domain",
      "tags": ["data-mining", "conference", "society"]
    },
    {
      "id": "venue-siggraph",
      "entity_name": "SIGGRAPH",
      "role": "venue",
      "aliases": ["SIGGRAPH", "ACM SIGGRAPH", "Special Interest Group on Computer Graphics and Interactive Techniques"],
      "official_domains": ["siggraph.org", "acm.org"],
      "homepages": ["https://www.siggraph.org/"],
      "preferred_page_urls": ["https://www.siggraph.org/"],
      "confidence": 0.82,
      "curation_status": "trusted_official_domain",
      "tags": ["graphics", "conference", "society"]
    },
    {
      "id": "venue-chi",
      "entity_name": "CHI",
      "role": "venue",
      "aliases": ["CHI", "ACM CHI", "Conference on Human Factors in Computing Systems"],
      "official_domains": ["sigchi.org", "acm.org"],
      "homepages": ["https://sigchi.org/conferences/conference-history/chi/"],
      "preferred_page_urls": ["https://sigchi.org/conferences/conference-history/chi/"],
      "confidence": 0.78,
      "curation_status": "trusted_official_domain",
      "tags": ["hci", "conference", "society"]
    },
    {
      "id": "source-arxiv",
      "entity_name": "arXiv",
      "role": "source",
      "aliases": ["arXiv", "arxiv.org"],
      "official_domains": ["arxiv.org"],
      "homepages": ["https://arxiv.org/"],
      "preferred_page_urls": ["https://arxiv.org/"],
      "confidence": 0.82,
      "curation_status": "trusted_official_domain",
      "tags": ["preprint", "source"]
    },
    {
      "id": "publisher-nature-medicine",
      "entity_name": "Nature Medicine",
      "role": "publisher",
      "aliases": ["Nature Medicine", "Nature Portfolio", "Springer Nature"],
      "official_domains": ["nature.com", "springernature.com"],
      "homepages": ["https://www.nature.com/nm/", "https://www.springernature.com/"],
      "preferred_page_urls": ["https://www.nature.com/nm/"],
      "confidence": 0.82,
      "curation_status": "trusted_official_domain",
      "tags": ["publisher", "journal"]
    },
    {
      "id": "venue-mlsys",
      "entity_name": "MLSys",
      "role": "venue",
      "aliases": ["MLSys", "Conference on Machine Learning and Systems"],
      "official_domains": ["mlsys.org"],
      "homepages": ["https://mlsys.org/"],
      "preferred_page_urls": ["https://mlsys.org/"],
      "confidence": 0.8,
      "curation_status": "trusted_official_domain",
      "tags": ["ml", "systems", "conference"]
    },
    {
      "id": "institution-stanford",
      "entity_name": "Stanford University",
      "role": "institution",
      "aliases": ["Stanford", "Stanford University", "Leland Stanford Junior University"],
      "official_domains": ["stanford.edu", "identity.stanford.edu"],
      "homepages": ["https://www.stanford.edu/", "https://identity.stanford.edu/"],
      "preferred_page_urls": ["https://identity.stanford.edu/"],
      "confidence": 0.88,
      "curation_status": "trusted_official_domain",
      "tags": ["university"]
    },
    {
      "id": "institution-mit",
      "entity_name": "MIT",
      "role": "institution",
      "aliases": ["MIT", "Massachusetts Institute of Technology"],
      "official_domains": ["mit.edu", "web.mit.edu", "brand.mit.edu"],
      "homepages": ["https://web.mit.edu/", "https://brand.mit.edu/"],
      "preferred_page_urls": ["https://brand.mit.edu/"],
      "confidence": 0.88,
      "curation_status": "trusted_official_domain",
      "tags": ["university"]
    },
    {
      "id": "institution-uw-madison",
      "entity_name": "University of Wisconsin-Madison",
      "role": "institution",
      "aliases": ["University of Wisconsin-Madison", "UW-Madison", "Wisconsin-Madison", "University of Wisconsin Madison"],
      "official_domains": ["wisc.edu", "brand.wisc.edu", "umark.wisc.edu"],
      "homepages": ["https://www.wisc.edu/", "https://brand.wisc.edu/"],
      "preferred_page_urls": ["https://brand.wisc.edu/visual-identity/logos/"],